21:16:46.920222 IP 192.168.1.180.58869 > 54.215.241.186.443: Flags [S], seq 1155832375, win 64240, options [mss 1460,nop,nop,sackOK], length 0
21:16:47.756253 IP6 fe80::a00:27ff:fe25:ca8c > ff02::16: HBH ICMP6, multicast listener report v2, 2 group record(s), length 48
21:16:49.434994 IP 192.168.1.180.58861 > 35.160.65.111.443: Flags [.], seq 2260182455:2260182456, ack 58435099, win 64800, length 1
21:16:49.759146 IP 35.160.65.111.443 > 192.168.1.180.58861: Flags [.], ack 1, win 23571, options [nop,nop,sack 1 {0:1}], length 0
21:16:51.017288 IP 192.168.1.180.58863 > 35.160.86.57.443: Flags [.], seq 725649048:725649049, ack 3866913055, win 64800, length 1
21:16:51.336428 IP 35.160.86.57.443 > 192.168.1.180.58863: Flags [.], ack 1, win 29070, options [nop,nop,sack 1 {0:1}], length 0
21:16:51.904004 IP 192.168.1.180.58865 > 35.165.2.110.443: Flags [.], seq 859141492:859141493, ack 2039525572, win 63984, length 1
21:16:52.071068 IP 192.168.1.180.58866 > 52.41.163.62.443: Flags [.], seq 3452788757:3452788758, ack 2953803025, win 63761, length 1
21:16:52.282131 IP 35.165.2.110.443 > 192.168.1.180.58865: Flags [.], ack 1, win 28944, options [nop,nop,sack 1 {0:1}], length 0
21:16:52.404798 IP 52.41.163.62.443 > 192.168.1.180.58866: Flags [.], ack 1, win 28964, options [nop,nop,sack 1 {0:1}], length 0
