20:23:00.186574 ARP, Request who-has 192.168.1.180 tell 192.168.1.1, length 46
20:23:00.186589 ARP, Reply 192.168.1.180 is-at 68:14:01:4e:43:53, length 46
20:23:00.243440 IP 192.168.1.104.52529 > 255.255.255.255.1947: UDP, length 40
20:23:00.408813 IP6 fe80::a00:27ff:fe25:ca8c > ff02::16: HBH ICMP6, multicast listener report v2, 2 group record(s), length 48
20:23:02.905891 ARP, Request who-has 192.168.1.162 tell 192.168.1.162, length 46
20:23:04.029080 IP 192.168.1.180.55658 > 35.186.224.47.443: Flags [P.], seq 2844505939:2844505974, ack 1536699209, win 63899, length 35
20:23:04.057294 IP 35.186.224.47.443 > 192.168.1.180.55658: Flags [.], ack 35, win 62790, length 0
20:23:04.207801 IP 35.186.224.47.443 > 192.168.1.180.55658: Flags [P.], seq 1:32, ack 35, win 62790, length 31
20:23:04.247937 IP 192.168.1.180.55658 > 35.186.224.47.443: Flags [.], ack 32, win 63868, length 0
20:23:04.339512 IP 192.168.1.104.52529 > 192.168.1.255.1947: UDP, length 40
